id,topic_key,difficulty,question,option_1,option_2,option_3,option_4,option_5,option_6,correct_option_ids,explanation,source
net-001,network,normal,Какой протокол обычно используется для разрешения доменного имени в IP-адрес?,DNS,DHCP,SMTP,ARP,,,1,DNS сопоставляет доменные имена с IP-адресами,
net-002,network,hard,Какой DNS-записью обычно указывают IPv4-адрес хоста?,A,AAAA,MX,TXT,,,1,A-запись сопоставляет имя с IPv4-адресом,
sec-001,security,normal,Что означает принцип least privilege?,Давать только необходимые права,Давать всем права администратора,Отключать аудит,Хранить пароли в коде,,,1,Минимальные необходимые права уменьшают последствия ошибки или взлома,
sys-001,system,easy,Какая команда Linux показывает текущий каталог?,pwd,cd,ls,whoami,,,1,pwd печатает рабочий каталог,
hw-001,hardware,easy,Какой компонент обычно хранит данные после выключения питания?,SSD,RAM,CPU,L1 cache,,,1,SSD является энергонезависимым накопителем,
